{
  "artifacts": [
    {
      "artifact_id": "art.server.trace",
      "backend_build": "synthetic-mechanics-build-0",
      "build_revision": "synthetic-mechanics-build-0",
      "command": "tests/make_evidence_fixtures.py --emit art.server.trace",
      "device_id": "SERVER",
      "kind": "JSON",
      "path": "synthetic/art.server.trace.json",
      "producing_tool": "s10_v0r_mechanics_generator",
      "provenance": "SYNTHETIC",
      "sha256": "eb3f7cc314d689cdaef89d8e581707e87fba01b0ba9fdd8e716131b58cd3887c",
      "source_revision": "933c722f6",
      "timestamp_utc": "20260715T000000Z",
      "validity_us": 3600000000
    },
    {
      "artifact_id": "art.server.power",
      "backend_build": "synthetic-mechanics-build-0",
      "build_revision": "synthetic-mechanics-build-0",
      "command": "tests/make_evidence_fixtures.py --emit art.server.power",
      "device_id": "SERVER",
      "kind": "JSON",
      "path": "synthetic/art.server.power.json",
      "producing_tool": "s10_v0r_mechanics_generator",
      "provenance": "SYNTHETIC",
      "sha256": "3224481f110b009a42dbc4a7b921755dfc0c288be4b0bff13c5a867cbb15d5a8",
      "source_revision": "933c722f6",
      "timestamp_utc": "20260715T000000Z",
      "validity_us": 3600000000
    },
    {
      "artifact_id": "art.op15.trace",
      "backend_build": "synthetic-mechanics-build-0",
      "build_revision": "synthetic-mechanics-build-0",
      "command": "tests/make_evidence_fixtures.py --emit art.op15.trace",
      "device_id": "OP15",
      "kind": "JSON",
      "path": "synthetic/art.op15.trace.json",
      "producing_tool": "s10_v0r_mechanics_generator",
      "provenance": "SYNTHETIC",
      "sha256": "d7b079ee9fcbdbbaf951d12380bef8ca4d888539b71c125e4155f5af8c5930ec",
      "source_revision": "933c722f6",
      "timestamp_utc": "20260715T000000Z",
      "validity_us": 3600000000
    },
    {
      "artifact_id": "art.op15.power",
      "backend_build": "synthetic-mechanics-build-0",
      "build_revision": "synthetic-mechanics-build-0",
      "command": "tests/make_evidence_fixtures.py --emit art.op15.power",
      "device_id": "OP15",
      "kind": "JSON",
      "path": "synthetic/art.op15.power.json",
      "producing_tool": "s10_v0r_mechanics_generator",
      "provenance": "SYNTHETIC",
      "sha256": "7ca009be6869b8714e704cdbda6a5e48d43a934cffb87f7859a387ad69a0d988",
      "source_revision": "933c722f6",
      "timestamp_utc": "20260715T000000Z",
      "validity_us": 3600000000
    },
    {
      "artifact_id": "art.boundary",
      "backend_build": "synthetic-mechanics-build-0",
      "build_revision": "synthetic-mechanics-build-0",
      "command": "tests/make_evidence_fixtures.py --emit art.boundary",
      "device_id": "SERVER",
      "kind": "JSON",
      "path": "synthetic/art.boundary.json",
      "producing_tool": "s10_v0r_mechanics_generator",
      "provenance": "SYNTHETIC",
      "sha256": "a5ddd14567d5edc2ddc1a1c44882bcb02cf73650a5a6f6f77e21345d78608c58",
      "source_revision": "933c722f6",
      "timestamp_utc": "20260715T000000Z",
      "validity_us": 3600000000
    },
    {
      "artifact_id": "art.boundary.op15",
      "backend_build": "synthetic-mechanics-build-0",
      "build_revision": "synthetic-mechanics-build-0",
      "command": "tests/make_evidence_fixtures.py --emit art.boundary.op15",
      "device_id": "OP15",
      "kind": "JSON",
      "path": "synthetic/art.boundary.op15.json",
      "producing_tool": "s10_v0r_mechanics_generator",
      "provenance": "SYNTHETIC",
      "sha256": "2523dfd40dc72219ef5b9bd1c9e5fc0d308a306356c6bf3c0dd31dcc2fb63293",
      "source_revision": "933c722f6",
      "timestamp_utc": "20260715T000000Z",
      "validity_us": 3600000000
    },
    {
      "artifact_id": "art.reference.cpu",
      "backend_build": "synthetic-mechanics-build-0",
      "build_revision": "synthetic-mechanics-build-0",
      "command": "tests/make_evidence_fixtures.py --emit art.reference.cpu",
      "device_id": "REFERENCE_CPU",
      "kind": "JSON",
      "path": "synthetic/art.reference.cpu.json",
      "producing_tool": "s10_v0r_mechanics_generator",
      "provenance": "SYNTHETIC",
      "sha256": "44474b9134876e863fdcaaa2d563cd68832d538ccf48f2e37d0b937413195ce9",
      "source_revision": "933c722f6",
      "timestamp_utc": "20260715T000000Z",
      "validity_us": 3600000000
    }
  ],
  "boundaries": [
    {
      "artifacts": [
        "art.boundary"
      ],
      "backend_build": "synthetic-mechanics-build-0",
      "boundary_wall_us": 0,
      "contention_state": "ISOLATED",
      "d2h_bytes": 0,
      "device_id": "SERVER",
      "direction": "INTRA_HOST",
      "energy_nj": 0,
      "energy_scope": "SERVER_WALL",
      "graph_id": "graph.g0",
      "h2d_bytes": 0,
      "island_id": "island.ffn",
      "kind": "BoundaryProfile",
      "materialization_us": 0,
      "model_id": "m0",
      "output_bytes": 0,
      "prepare_us": 0,
      "process_count": 8,
      "reason_code": "SYNTHETIC_MECHANICS_FIXTURE",
      "record_id": "bnd.n0",
      "record_sha256": "2a2026fb1e8fbeae9877e0cc642517cf48e18594304573902daa07e4f0a4b1ce",
      "record_version": 3,
      "sample_count": 64,
      "status": "PASS",
      "transfer_us": 0,
      "transport_domain": "NONE",
      "verification_us": 0,
      "warmup_us": 0,
      "weight_set_id": "w0"
    },
    {
      "artifacts": [
        "art.boundary"
      ],
      "backend_build": "synthetic-mechanics-build-0",
      "boundary_wall_us": 0,
      "contention_state": "ISOLATED",
      "d2h_bytes": 0,
      "device_id": "SERVER",
      "direction": "INTRA_HOST",
      "energy_nj": 0,
      "energy_scope": "SERVER_WALL",
      "graph_id": "graph.g1",
      "h2d_bytes": 0,
      "island_id": "island.ffn",
      "kind": "BoundaryProfile",
      "materialization_us": 0,
      "model_id": "m1",
      "output_bytes": 0,
      "prepare_us": 0,
      "process_count": 8,
      "reason_code": "SYNTHETIC_MECHANICS_FIXTURE",
      "record_id": "bnd.n1",
      "record_sha256": "e3bd177f0b4249f4710694d434ada04b606639c51769f9a4dfed3098eb1f165b",
      "record_version": 3,
      "sample_count": 64,
      "status": "PASS",
      "transfer_us": 0,
      "transport_domain": "NONE",
      "verification_us": 0,
      "warmup_us": 0,
      "weight_set_id": "w1"
    },
    {
      "artifacts": [
        "art.boundary"
      ],
      "backend_build": "synthetic-mechanics-build-0",
      "boundary_wall_us": 0,
      "contention_state": "ISOLATED",
      "d2h_bytes": 0,
      "device_id": "SERVER",
      "direction": "INTRA_HOST",
      "energy_nj": 0,
      "energy_scope": "SERVER_WALL",
      "graph_id": "graph.cap",
      "h2d_bytes": 0,
      "island_id": "island.capacity",
      "kind": "BoundaryProfile",
      "materialization_us": 0,
      "model_id": "mcap",
      "output_bytes": 0,
      "prepare_us": 0,
      "process_count": 8,
      "reason_code": "SYNTHETIC_MECHANICS_FIXTURE",
      "record_id": "bnd.capacity",
      "record_sha256": "e34a3818e8c2b68fef49d6265e6312e86fb80595d090866437f11b49dc871d64",
      "record_version": 3,
      "sample_count": 64,
      "status": "PASS",
      "transfer_us": 0,
      "transport_domain": "NONE",
      "verification_us": 0,
      "warmup_us": 0,
      "weight_set_id": "wcap"
    },
    {
      "artifacts": [
        "art.boundary"
      ],
      "backend_build": "synthetic-mechanics-build-0",
      "boundary_wall_us": 0,
      "contention_state": "ISOLATED",
      "d2h_bytes": 0,
      "device_id": "SERVER",
      "direction": "INTRA_HOST",
      "energy_nj": 0,
      "energy_scope": "SERVER_WALL",
      "graph_id": "graph.a",
      "h2d_bytes": 0,
      "island_id": "island.ffn",
      "kind": "BoundaryProfile",
      "materialization_us": 0,
      "model_id": "m0",
      "output_bytes": 100,
      "prepare_us": 0,
      "process_count": 8,
      "reason_code": "SYNTHETIC_MECHANICS_FIXTURE",
      "record_id": "bnd.a.p0",
      "record_sha256": "7cfe1a58da2c2220cbefe66835ed566b0570ae94ee38690acae80ab489eb44d5",
      "record_version": 3,
      "sample_count": 64,
      "status": "PASS",
      "transfer_us": 0,
      "transport_domain": "NONE",
      "verification_us": 0,
      "warmup_us": 0,
      "weight_set_id": "wp"
    },
    {
      "artifacts": [
        "art.boundary"
      ],
      "backend_build": "synthetic-mechanics-build-0",
      "boundary_wall_us": 0,
      "contention_state": "ISOLATED",
      "d2h_bytes": 0,
      "device_id": "SERVER",
      "direction": "INTRA_HOST",
      "energy_nj": 0,
      "energy_scope": "SERVER_WALL",
      "graph_id": "graph.a",
      "h2d_bytes": 0,
      "island_id": "island.ffn",
      "kind": "BoundaryProfile",
      "materialization_us": 0,
      "model_id": "m1",
      "output_bytes": 100,
      "prepare_us": 0,
      "process_count": 8,
      "reason_code": "SYNTHETIC_MECHANICS_FIXTURE",
      "record_id": "bnd.a.p1",
      "record_sha256": "7ec19d89209495633912c481409a2c79aed7dde23d891d9b2fbfb439b87b54d6",
      "record_version": 3,
      "sample_count": 64,
      "status": "PASS",
      "transfer_us": 0,
      "transport_domain": "NONE",
      "verification_us": 0,
      "warmup_us": 0,
      "weight_set_id": "wp"
    },
    {
      "artifacts": [
        "art.boundary.op15"
      ],
      "backend_build": "synthetic-mechanics-build-0",
      "boundary_wall_us": 0,
      "contention_state": "ISOLATED",
      "d2h_bytes": 0,
      "device_id": "OP15",
      "direction": "HOST_TO_PHONE",
      "energy_nj": 0,
      "energy_scope": "SERVER_WALL",
      "graph_id": "graph.a",
      "h2d_bytes": 0,
      "island_id": "island.ffn",
      "kind": "BoundaryProfile",
      "materialization_us": 0,
      "model_id": "m0",
      "output_bytes": 0,
      "prepare_us": 0,
      "process_count": 8,
      "reason_code": "SYNTHETIC_MECHANICS_FIXTURE",
      "record_id": "bnd.a.c0",
      "record_sha256": "df2ef07576826b999c29c523320882862f42ec4096d2097f882f64fe52870d4f",
      "record_version": 3,